<manifest
	xmlns="http://xml.safris.org/toolkit/binding/manifest.xsd"
	xmlns:xsi="http://www.w3.org/2001/XMLSchema-instance"
	xsi:schemaLocation="http://xml.safris.org/toolkit/binding/manifest.xsd ../../../../../../toolkit/binding/src/main/resources/xsd/manifest.xsd">
	<destdir explodeJars="true">${project.build.directory}/generated-sources/xmlbinding</destdir>
	<schemas>
		<!--
			<schema>${basedir}/src/test/resources/xsd/XMLSchema.xsd</schema>
		-->
		<schema>${basedir}/src/test/resources/xsd/xml.xsd</schema>

		<schema>${basedir}/src/test/resources/xsd/unit/id.xsd</schema>
		<schema>${basedir}/src/test/resources/xsd/unit/order.xsd</schema>
		<schema>${basedir}/src/test/resources/xsd/unit/name.xsd</schema>
		<schema>${basedir}/src/test/resources/xsd/unit/union.xsd</schema>
		<schema>${basedir}/src/test/resources/xsd/unit/substitutionGroup.xsd</schema>
		<schema>${basedir}/src/test/resources/xsd/unit/list.xsd</schema>
		<schema>${basedir}/src/test/resources/xsd/unit/simpleType.xsd</schema>
		<schema>${basedir}/src/test/resources/xsd/unit/attribute.xsd</schema>
		<schema>${basedir}/src/test/resources/xsd/unit/type.xsd</schema>
		<schema>${basedir}/src/test/resources/xsd/unit/namespace.xsd</schema>
		<schema>${basedir}/src/test/resources/xsd/unit/complexType.xsd</schema>
		<schema>${basedir}/src/test/resources/xsd/unit/mixed.xsd</schema>
		<!--
			<schema>${basedir}/src/test/resources/xsd/unit/everything.xsd</schema>
		-->
		<schema>${basedir}/src/test/resources/xsd/unit/redefine.xsd</schema>
		<schema>${basedir}/src/test/resources/xsd/xhtml/xhtml1-taglib.xsd</schema>
		<schema>${basedir}/src/test/resources/xsd/maven-v4_0_0.xsd</schema>
		<schema>${basedir}/src/test/resources/xsd/liberty/exc-c14n.xsd</schema>
		<schema>${basedir}/src/test/resources/xsd/liberty/xenc-schema.xsd</schema>
		<schema>${basedir}/src/test/resources/xsd/liberty/xmldsig-core-schema.xsd</schema>
		<schema>${basedir}/src/test/resources/xsd/liberty/cs-sstc-schema-assertion-01.xsd</schema>
		<schema>${basedir}/src/test/resources/xsd/liberty/cs-sstc-schema-protocol-01.xsd</schema>
		<schema>${basedir}/src/test/resources/xsd/liberty/soap-envelope.xsd</schema>
		<schema>${basedir}/src/test/resources/xsd/liberty/aol-lib-config.xsd</schema>
		<schema>${basedir}/src/test/resources/xsd/liberty/lib-id-sis-pp.xsd</schema>
		<schema>${basedir}/src/test/resources/xsd/liberty/lib-arch-authn-context.xsd</schema>
		<schema>${basedir}/src/test/resources/xsd/liberty/lib-arch-disco-svc.xsd</schema>
		<schema>${basedir}/src/test/resources/xsd/liberty/lib-arch-metadata.xsd</schema>
		<schema>${basedir}/src/test/resources/xsd/liberty/lib-arch-soap-binding.xsd</schema>
		<schema>${basedir}/src/test/resources/xsd/liberty/lib-arch-protocols-schema.xsd</schema>

		<!--
			These all define the same namespace, and cannot be built into any specific package.
			Only one of these schemas can be generated! The intention of these schemas must be to
			have them be included into other schemas with no targetNamespace.
		-->

		<schema>${basedir}/src/test/resources/xsd/taglibs/j2ee_1_4.xsd</schema>
		<!--
			<schema>${basedir}/src/test/resources/xsd/taglibs/ejb-jar_2_1.xsd</schema>
			<schema>${basedir}/src/test/resources/xsd/taglibs/web-jsptaglibrary_2_0.xsd</schema>
			<schema>${basedir}/src/test/resources/xsd/taglibs/j2ee_web_services_client_1_1.xsd</schema>
		-->
		<schema>${basedir}/src/test/resources/xsd/safris-game-chess.xsd</schema>
		<schema>${basedir}/src/test/resources/xsd/xdb.xsd</schema>
		<schema>${basedir}/src/test/resources/xsd/test.xsd</schema>
		<schema>${basedir}/src/test/resources/xsd/test2.xsd</schema>
	</schemas>
</manifest>
