<!--
	Copyright 2008 Safris Technologies Inc.

	Licensed under the Apache License, Version 2.0 (the "License");
	you may not use this file except in compliance with the License.
	You may obtain a copy of the License at

			http://www.apache.org/licenses/LICENSE-2.0

	Unless required by applicable law or agreed to in writing, software
	distributed under the License is distributed on an "AS IS" BASIS,
	WITHOUT WARRANTIES OR CONDITIONS OF ANY KIND, either express or implied.
	See the License for the specific language governing permissions and
	limitations under the License.
-->

<manifest
	xmlns="http://xml.safris.org/toolkit/binding/manifest.xsd"
	xmlns:xsi="http://www.w3.org/2001/XMLSchema-instance"
	xsi:schemaLocation="http://xml.safris.org/toolkit/binding/manifest.xsd ../../../../../../toolkit/binding/src/main/resources/xsd/manifest.xsd">
	<destdir explodeJars="true">${project.build.directory}/generated-sources/xmlbinding</destdir>
	<schemas>
		<schema>${basedir}/src/main/resources/xsd/substitutionGroup.xsd</schema>
		<schema>${basedir}/src/main/resources/xsd/xsitype.xsd</schema>
		<schema>${basedir}/src/main/resources/xsd/simple.xsd</schema>
		<schema>${basedir}/src/main/resources/xsd/enums.xsd</schema>
		<schema>${basedir}/src/main/resources/xsd/list.xsd</schema>
		<schema>${basedir}/src/main/resources/xsd/any.xsd</schema>
		<schema>${basedir}/src/main/resources/xsd/id.xsd</schema>
	</schemas>
</manifest>
